{
  "schema_version": 1, "schema_uri": "https://qedgen.dev/schemas/auditor/domain-dossier-v1.schema.json", "audit_id": "corpus_lending_liquidation",
  "target": { "program_root": "fixtures/lending", "runtime": "anchor", "mode": "spec-less", "spec": null, "source_commit": null },
  "handlers": [], "structural_candidates": [],
  "asset_flows": [{ "id": "flow_lending_borrow", "handler": "borrow", "asset": "debt_mint", "source": "liquidity_vault", "destination": "borrower", "nominal_amount": "debt_amount", "delivered_amount": null, "fee_expression": null, "authority": "market_authority", "state_mutations": ["position.debt += debt_amount"], "metadata": { "confidence": "derived", "ratification": "pending", "rationale": "Borrow transfers debt assets and increases debt.", "source_anchors": [{ "path": "src/lib.rs", "line_start": 30, "symbol": "borrow", "excerpt": "position.debt += amount" }], "verification_lanes": ["manual", "crucible"] } }],
  "quantities": [
    { "id": "qty_lending_debt", "symbol": "position.debt", "unit": "debt atoms", "scale": "debt_mint.decimals", "rounding": "ceil", "valid_range": null, "conversions": ["debt_value"], "metadata": { "confidence": "semantic", "ratification": "pending", "rationale": "Debt accrual should round against the borrower.", "source_anchors": [{ "path": "src/state.rs", "line_start": 8, "symbol": "debt", "excerpt": "debt: u64" }], "verification_lanes": ["manual", "crucible"] } },
    { "id": "qty_lending_collateral", "symbol": "position.collateral", "unit": "collateral atoms", "scale": "collateral_mint.decimals", "rounding": "exact", "valid_range": null, "conversions": ["collateral_value"], "metadata": { "confidence": "derived", "ratification": "pending", "rationale": "Collateral uses collateral mint atoms.", "source_anchors": [{ "path": "src/state.rs", "line_start": 9, "symbol": "collateral", "excerpt": "collateral: u64" }], "verification_lanes": ["manual"] } }
  ],
  "paired_operations": [{ "id": "pair_lending_debt", "left_operation": "borrow", "right_operation": "repay", "relationship": "repay reduces principal and accrued debt created by borrow", "left_handlers": ["borrow"], "right_handlers": ["repay"], "metadata": { "confidence": "semantic", "ratification": "pending", "rationale": "Debt lifecycle spans handlers and interest accrual.", "source_anchors": [{ "path": "src/lib.rs", "line_start": 30, "line_end": 70, "symbol": "borrow/repay", "excerpt": "borrow; repay" }], "verification_lanes": ["manual", "crucible"] } }],
  "lifecycle_edges": [], "authority_capabilities": [], "economic_equations": [],
  "external_assumptions": [{ "id": "assume_lending_oracle", "kind": "oracle", "claim": "Collateral and debt prices are fresh during borrow and liquidation.", "failure_effect": "Health checks can authorize insolvent borrowing or incorrect liquidation.", "metadata": { "confidence": "semantic", "ratification": "pending", "rationale": "Health depends on external price and clock state.", "source_anchors": [{ "path": "src/health.rs", "line_start": 12, "symbol": "health_factor", "excerpt": "collateral_value / debt_value" }], "verification_lanes": ["manual", "crucible"] } }]
}
