{
  "schema_version": 1, "schema_uri": "https://qedgen.dev/schemas/auditor/domain-dossier-v1.schema.json", "audit_id": "corpus_rewards_vesting",
  "target": { "program_root": "fixtures/rewards-vesting", "runtime": "anchor", "mode": "spec-less", "spec": null, "source_commit": null },
  "handlers": [], "structural_candidates": [], "asset_flows": [],
  "quantities": [{ "id": "qty_reward_accrued", "symbol": "position.accrued", "unit": "reward atoms", "scale": "reward_mint.decimals", "rounding": "floor", "valid_range": "0..=allocation", "conversions": ["emission_rate * elapsed_time"], "metadata": { "confidence": "semantic", "ratification": "pending", "rationale": "Accrual combines token scale, time, and integer carry.", "source_anchors": [{ "path": "src/rewards.rs", "line_start": 14, "symbol": "accrue", "excerpt": "elapsed * reward_rate" }], "verification_lanes": ["manual", "crucible"] } }],
  "paired_operations": [{ "id": "pair_rewards_accrue_claim", "left_operation": "accrue", "right_operation": "claim", "relationship": "claim transfers only vested accrued rewards and preserves unvested carry", "left_handlers": ["accrue"], "right_handlers": ["claim"], "metadata": { "confidence": "semantic", "ratification": "pending", "rationale": "The relationship depends on time and vesting intent.", "source_anchors": [{ "path": "src/rewards.rs", "line_start": 14, "line_end": 45, "symbol": "accrue/claim", "excerpt": "accrue; claim vested" }], "verification_lanes": ["manual", "crucible"] } }],
  "lifecycle_edges": [], "authority_capabilities": [],
  "economic_equations": [{ "id": "eq_rewards_budget", "name": "reward budget conservation", "expression": "claimed + accrued + unvested <= allocation", "scope": ["accrue", "claim"], "tolerance": "fractional carry below one reward atom", "unit_check": "compatible", "metadata": { "confidence": "semantic", "ratification": "pending", "rationale": "Budget conservation spans time and multiple claims.", "source_anchors": [{ "path": "src/rewards.rs", "line_start": 14, "line_end": 45, "symbol": "reward budget", "excerpt": "allocation; accrued; claimed" }], "verification_lanes": ["manual", "crucible"] } }],
  "external_assumptions": [{ "id": "assume_rewards_clock", "kind": "clock", "claim": "Clock time is monotonic between accrual and claim.", "failure_effect": "Elapsed-time arithmetic can over-accrue or unlock early.", "metadata": { "confidence": "semantic", "ratification": "pending", "rationale": "Vesting depends on an external time source.", "source_anchors": [{ "path": "src/rewards.rs", "line_start": 15, "symbol": "accrue", "excerpt": "clock.unix_timestamp" }], "verification_lanes": ["manual", "crucible"] } }]
}
