{
  "schema_version": 1, "schema_uri": "https://qedgen.dev/schemas/auditor/domain-dossier-v1.schema.json", "audit_id": "corpus_oracle",
  "target": { "program_root": "fixtures/oracle", "runtime": "native-rust", "mode": "spec-less", "spec": null, "source_commit": null },
  "handlers": [], "structural_candidates": [], "asset_flows": [],
  "quantities": [{ "id": "qty_oracle_price", "symbol": "price", "unit": "quote atoms per base token", "scale": "10^exponent", "rounding": "nearest", "valid_range": "price > 0", "conversions": ["normalize_exponent"], "metadata": { "confidence": "semantic", "ratification": "pending", "rationale": "Price meaning requires base, quote, and exponent intent.", "source_anchors": [{ "path": "src/lib.rs", "line_start": 11, "symbol": "Price", "excerpt": "price: i64, exponent: i32" }], "verification_lanes": ["manual", "crucible"] } }],
  "paired_operations": [{ "id": "pair_oracle_publish_consume", "left_operation": "publish_price", "right_operation": "consume_price", "relationship": "consumption accepts only a sufficiently fresh published observation", "left_handlers": ["publish_price"], "right_handlers": ["consume_price"], "metadata": { "confidence": "semantic", "ratification": "pending", "rationale": "Freshness is a cross-operation temporal guarantee.", "source_anchors": [{ "path": "src/lib.rs", "line_start": 20, "line_end": 45, "symbol": "price lifecycle", "excerpt": "publish_price; consume_price" }], "verification_lanes": ["manual", "crucible"] } }],
  "lifecycle_edges": [], "authority_capabilities": [], "economic_equations": [],
  "external_assumptions": [{ "id": "assume_oracle_clock", "kind": "clock", "claim": "The consumer clock is monotonic and comparable to the publication slot.", "failure_effect": "Stale observations can be treated as fresh.", "metadata": { "confidence": "semantic", "ratification": "pending", "rationale": "Freshness depends on the runtime clock model.", "source_anchors": [{ "path": "src/lib.rs", "line_start": 40, "symbol": "consume_price", "excerpt": "clock.slot - price.publish_slot" }], "verification_lanes": ["manual", "crucible"] } }]
}
