{
  "schema_version": 1, "schema_uri": "https://qedgen.dev/schemas/auditor/domain-dossier-v1.schema.json", "audit_id": "corpus_token_2022",
  "target": { "program_root": "fixtures/token-2022", "runtime": "anchor", "mode": "spec-less", "spec": null, "source_commit": null },
  "handlers": [], "structural_candidates": [],
  "asset_flows": [{ "id": "flow_token2022_transfer", "handler": "deposit", "asset": "extension_mint", "source": "user_account", "destination": "vault_account", "nominal_amount": "requested", "delivered_amount": "destination_post - destination_pre", "fee_expression": "withheld_transfer_fee", "authority": "user", "state_mutations": ["credit delivered amount"], "metadata": { "confidence": "derived", "ratification": "pending", "rationale": "Balance delta may differ from requested amount under extensions.", "source_anchors": [{ "path": "src/lib.rs", "line_start": 18, "symbol": "deposit", "excerpt": "transfer_checked; reload destination" }], "verification_lanes": ["manual", "mollusk", "crucible"] } }],
  "quantities": [{ "id": "qty_token2022_delivered", "symbol": "delivered", "unit": "mint atoms", "scale": "mint.decimals", "rounding": "floor", "valid_range": "0..=requested", "conversions": [], "metadata": { "confidence": "derived", "ratification": "pending", "rationale": "Transfer fees are withheld in mint atoms.", "source_anchors": [{ "path": "src/lib.rs", "line_start": 22, "symbol": "deposit", "excerpt": "post_balance - pre_balance" }], "verification_lanes": ["manual", "mollusk"] } }],
  "paired_operations": [{ "id": "pair_token2022_settlement", "left_operation": "transfer", "right_operation": "settle_accounting", "relationship": "accounting credits delivered rather than nominal transfer amount", "left_handlers": ["deposit"], "right_handlers": ["deposit"], "metadata": { "confidence": "semantic", "ratification": "pending", "rationale": "Correct settlement depends on enabled mint extensions.", "source_anchors": [{ "path": "src/lib.rs", "line_start": 18, "line_end": 25, "symbol": "deposit", "excerpt": "transfer; credit delivered" }], "verification_lanes": ["manual", "mollusk", "crucible"] } }],
  "lifecycle_edges": [], "authority_capabilities": [], "economic_equations": [],
  "external_assumptions": [{ "id": "assume_token2022_extensions", "kind": "token", "claim": "Transfer-fee and transfer-hook extensions are modeled for the accepted mint.", "failure_effect": "Nominal accounting or unmodeled hook effects can violate conservation.", "metadata": { "confidence": "semantic", "ratification": "pending", "rationale": "Extension behavior lives outside the program handler.", "source_anchors": [{ "path": "src/lib.rs", "line_start": 18, "symbol": "deposit", "excerpt": "token_interface::transfer_checked" }], "verification_lanes": ["manual", "mollusk"] } }]
}
