{
  "schema_version": 1, "schema_uri": "https://qedgen.dev/schemas/auditor/domain-dossier-v1.schema.json", "audit_id": "corpus_governance",
  "target": { "program_root": "fixtures/governance", "runtime": "anchor", "mode": "spec-less", "spec": null, "source_commit": null },
  "handlers": [], "structural_candidates": [], "asset_flows": [],
  "quantities": [{ "id": "qty_governance_weight", "symbol": "proposal.yes_weight", "unit": "vote-weight units", "scale": "governance_config.weight_scale", "rounding": "floor", "valid_range": "0..=snapshot_supply", "conversions": ["deposit_to_vote_weight"], "metadata": { "confidence": "semantic", "ratification": "pending", "rationale": "Vote weight depends on snapshot and governance policy.", "source_anchors": [{ "path": "src/vote.rs", "line_start": 18, "symbol": "cast_vote", "excerpt": "yes_weight += voter_weight" }], "verification_lanes": ["manual", "crucible"] } }],
  "paired_operations": [{ "id": "pair_governance_execute", "left_operation": "cast_vote", "right_operation": "execute_proposal", "relationship": "execution requires a finalized proposal whose snapshot vote meets quorum", "left_handlers": ["cast_vote"], "right_handlers": ["execute_proposal"], "metadata": { "confidence": "semantic", "ratification": "pending", "rationale": "Authorization depends on accumulated snapshot state.", "source_anchors": [{ "path": "src/lib.rs", "line_start": 30, "line_end": 80, "symbol": "proposal lifecycle", "excerpt": "cast_vote; execute_proposal" }], "verification_lanes": ["manual", "crucible"] } }],
  "lifecycle_edges": [{ "id": "edge_governance_finalize", "account": "proposal", "handler": "finalize_proposal", "from": "Voting", "to": "Succeeded", "guards": ["voting_period_ended", "yes_weight >= quorum"], "terminal": false, "metadata": { "confidence": "semantic", "ratification": "pending", "rationale": "Success depends on governance quorum intent.", "source_anchors": [{ "path": "src/proposal.rs", "line_start": 24, "symbol": "finalize_proposal", "excerpt": "status = Succeeded" }], "verification_lanes": ["manual", "crucible"] } }],
  "authority_capabilities": [{ "id": "cap_governance_executor", "role": "proposal executor", "identity_anchor": "proposal.status == Succeeded", "handler": "execute_proposal", "effects": ["invoke approved action", "proposal.status = Executed"], "limits": ["execute once", "approved instruction only"], "revocation_path": null, "metadata": { "confidence": "semantic", "ratification": "pending", "rationale": "Authority is conferred by proposal state rather than a fixed key.", "source_anchors": [{ "path": "src/execute.rs", "line_start": 10, "symbol": "execute_proposal", "excerpt": "require status == Succeeded" }], "verification_lanes": ["manual", "crucible"] } }],
  "economic_equations": [], "external_assumptions": []
}
